,q,ch,a,answer_mcq,score
0,"Apa yang dimaksud dengan ""Efek"" dalam regulasi Otoritas Jasa Keuangan?","A) Dokumen keuangan apa pun
B) Pernyataan tertulis terkait penawaran umum
C) Unit kontrak investasi kolektif
D) Bentuk pengakuan utang",C) Unit kontrak investasi kolektif,"Dalam regulasi Otoritas Jasa Keuangan, yang dimaksud dengan ""Efek"" adalah surat berharga, yaitu surat pengakuan utang, surat berharga komersial, saham, obligasi, tanda bukti utang, unit penyertaan kontrak investasi kolektif, kontrak berjangka atas Efek, dan setiap derivatif atas Efek. (Peraturan Otoritas Jasa Keuangan Nomor 10/POJK.04/2",1
1,Apa yang dilarang dalam promosi pemasaran Efek menurut Pasal 2?,"A) Mengungkapkan risiko investasi
B) Memberikan gambaran yang menyesatkan
C) Memuat informasi benar
D) Hanya mempromosikan Prospektus",B) Memberikan gambaran yang menyesatkan,Pasal 2 Peraturan Otoritas Jasa Keuangan Nomor 7/POJK.04/2,1
2,Apa yang wajib dimuat dalam promosi pemasaran Efek menurut Pasal 3?,"A) Informasi bahwa Efek hanya cocok untuk kelompok pemodal tertentu
B) Harga pasar saat promosi dibuat
C) Nama Pihak yang memberikan rekomendasi
D) Keterangan tentang perdagangan Efek tersebut",A) Informasi bahwa Efek hanya cocok untuk kelompok pemodal tertentu,"Jawab: A) Informasi bahwa Efek hanya cocok untuk kelompok pemodal tertentu

Alasan: Pasal 3 huruf (a) Peraturan Otoritas Jasa Keuangan Republik Indonesia Nomor 7/POJK.04/2",1
3,Apa yang diwajibkan oleh Pasal 5 dalam hal promosi pemasaran Efek?,"A) Mengungkapkan risiko investasi
B) Memuat pendapat, proyeksi, atau ramalan secara jelas
C) Hanya mencantumkan informasi yang positif
D) Tidak memperbolehkan promosi pemasaran Efek","B) Memuat pendapat, proyeksi, atau ramalan secara jelas","Jawab: B) Memuat pendapat, proyeksi, atau ramalan secara jelas

Keterangan: Pasal 5 dalam Peraturan Otoritas Jasa Keuangan Republik Indonesia Nomor 7/POJK.04/2",1
4,Apa yang harus dimuat dalam promosi pemasaran Efek menurut Pasal 6 dalam rangka Penawaran Umum?,"A) Informasi tentang promosi pemasaran Efek
B) Prospektus atau kesempatan untuk membaca Prospektus
C) Nominal nilai Efek
D) Pernyataan Pendaftaran",B) Prospektus atau kesempatan untuk membaca Prospektus,"Jawab: B) Prospektus atau kesempatan untuk membaca Prospektus.

Pasal 6 dalam rangka Penawaran Umum menetapkan bahwa dalam promosi pemasaran effek wajib memuat informasi bahwa pemodal hanya dapat melakukan pemesanan pembelian effek setelah pemodal dimaksud memperoleh Prospektus atau memperoleh kesempatan untuk membaca Prospektus, dan setelah Pernyataan Pendaftaran efektif. Hal ini disesuaikan dengan Peraturan Otoritas Jasa Keuangan Nomor 7/POJK.04/2019 Tentang Promosi Pemasaran Efek termasuk Iklan, Brosur, atau Komunikasi Lainnya Kepada Publik.",1
5,Apa yang dapat dilakukan oleh Otoritas Jasa Keuangan terkait pengenaan sanksi administratif menurut Pasal 9?,"A) Dapat mengumumkan kepada masyarakat
B) Hanya memberikan peringatan tertulis
C) Melakukan tindakan tertentu kepada Pihak yang melanggar
D) Menunda pengenaan sanksi",A) Dapat mengumumkan kepada masyarakat,"Jawab: A) Dapat mengumumkan kepada masyarakat

Keterangan: Menurut Peraturan Otoritas Jasa Keuangan Nomor 7/POJK.04/2",1
6,Kapan Peraturan Otoritas Jasa Keuangan ini mulai berlaku?,"A) Setelah diumumkan kepada masyarakat
B) Tanggal diundangkan
C) Setelah Keputusan Ketua Badan Pengawas Pasar Modal dicabut
D) Pada saat Peraturan ini disetujui oleh masyarakat",B) Tanggal diundangkan,Pasal 62 (1) Peraturan Otoritas Jasa Keuangan Nomor 6/POJK.07/2,1
7,"Apa yang dimaksud dengan ""Perusahaan Terbuka"" menurut Pasal 1?","A) Perusahaan yang hanya melayani umum
B) Emiten yang melakukan penawaran umum efek bersifat ekuitas atau perusahaan publik
C) Organisasi non-profit
D) Perusahaan yang tidak terdaftar di bursa saham",B) Emiten yang melakukan penawaran umum efek bersifat ekuitas atau perusahaan publik,"Selamat datang! Saya siap untuk menjawab pertanyaan Anda mengenai kapital market regulation di Indonesia. Berdasarkan informasi yang Anda berikan, yaitu Peraturan Otoritas Jasa Keuangan Nomor 9/POJK.04/2018, 15/POJK.04/2020, 15/POJK.04/2022, serta 11/POJK.04/2",1
8,Siapa yang memiliki wewenang yang tidak diberikan kepada direksi atau dewan komisaris dalam Perusahaan Terbuka?,"A) Pemegang Saham Independen
B) Penerima Kuasa
C) Pengguna e-RUPS
D) Rapat Umum Pemegang Saham (RUPS)",D) Rapat Umum Pemegang Saham (RUPS),"Jawab: D
Rapat Umum Pemegang Saham (RUPS)

Keterangan:
Sesuai dengan Peraturan Otoritas Jasa Keuangan Nomor 16/POJK.04/2020 Tentang Pelaksanaan Rapat Umum Pemegang Saham Perusahaan Terbuka Secara Elektronik, dalam Pasal 1 Peraturan tersebut, di definisikan bahwa Rapat Umum Pemegang Saham (RUPS) adalah suatu kegiatan berupa rapat yang diadakan oleh Perusahaan Terbuka dengan tujuan untuk mengambil keputusan atas masalah yang penting bagi Perusahaan Terbuka. Hal ini menunjukkan bahwa RUPS memiliki wewenang yang tidak diberikan kepada Direksi atau Dewan Komisaris dalam Perusahaan Terbuka.",0
9,Kapan Perusahaan Terbuka wajib menyelenggarakan RUPS Tahunan menurut Pasal 2 ayat (2)?,"A) Paling lambat 1 bulan setelah tahun buku berakhir
B) Paling lambat 3 bulan setelah tahun buku berakhir
C) Paling lambat 6 bulan setelah tahun buku berakhir
D) Paling lambat 9 bulan setelah tahun buku berakhir",C) Paling lambat 6 bulan setelah tahun buku berakhir,Pasal 2 ayat (2) dari Peraturan Otoritas Jasa Keuangan Republik Indonesia Nomor 15/POJK.04/2,0
10,Siapa yang dapat mengajukan permintaan penyelenggaraan RUPS menurut Pasal 3 ayat (1)?,"A) Hanya pemegang saham yang mewakili lebih dari 1/10 saham dengan hak suara
B) Hanya Direksi
C) Dewan Komisaris
D) Pemegang saham dan Dewan Komisaris",D) Pemegang saham dan Dewan Komisaris,"Jawab: A

Penyelenggaraan Rapat Umum Pemegang Saham (RUPS) dapat dilakukan atas permintaan 1 (satu) orang atau lebih pemegang saham yang bersama-sama mewakili 1/10 (satu persepuluh) atau lebih dari jumlah seluruh saham dengan hak suara, kecuali anggaran dasar menentukan suatu jumlah yang lebih kecil. Hal ini disampaikan dalam Pasal 3 ayat (1) huruf a PERATURAN OTORITAS JASA KEUANGAN REPUBLIK INDONESIA NOMOR 15/POJK.04/2020 TENTANG RENCANA DAN PENYELENGGARAAN RAPAT UMUM PEMEGANG SAHAM PERUSAHAAN TERBUKA. Oleh karena itu, jawaban yang benar adalah A).",0
11,Kapan Direksi wajib melakukan pengumuman RUPS setelah menerima permintaan penyelenggaraan RUPS menurut Pasal 4 ayat (1)?,"A) Paling lambat 7 hari
B) Paling lambat 10 hari
C) Paling lambat 15 hari
D) Paling lambat 20 hari",C) Paling lambat 15 hari,"Jawab: C) Paling lambat 15 hari

Pasal 4 ayat (1) PERATURAN OTORITAS JASA KEUANGAN REPUBLIK INDONESIA NOMOR 15/POJK.04/2020 TENTANG RENCANA DAN PENYELENGGARAAN RAPAT UMUM PEMEGANG SAHAM PERUSAHAAN TERBUKA menetapkan bahwa Direksi wajib melakukan pengumuman RUPS kepada pemegang saham paling lambat 15 (lima belas) hari terhitung sejak tanggal permintaan penyelenggaraan RUPS sebagaimana dimaksud dalam Pasal 3 ayat (1) diterima Direksi. Oleh karena itu, jawaban yang benar adalah C) Paling lambat 15 hari.",0
12,"Apa yang dapat dilakukan pemegang saham jika Direksi tidak melakukan pengumuman RUPS atas usulan mereka, menurut Pasal 5 ayat (2)?","A) Melakukan pengumuman RUPS sendiri
B) Mengajukan kembali permintaan penyelenggaraan RUPS kepada Dewan Komisaris
C) Tidak ada opsi lain, harus menerima keputusan Direksi
D) Melaporkan Direksi kepada Otoritas Jasa Keuangan",B) Mengajukan kembali permintaan penyelenggaraan RUPS kepada Dewan Komisaris,"Jawab: B) Mengajukan kembali permintaan penyelenggaraan RUPS kepada Dewan Komisaris

Keputusan ini didasarkan pada Pasal 5 ayat (2) dari Peraturan Otoritas Jasa Keuangan Republik Indonesia Nomor 15/POJK.04/2020 tentang Rencana dan Penyelenggaraan Rapat Umum Pemegang Saham Perusahaan Terbuka. Pasal tersebut menyatakan bahwa jika Direksi tidak melakukan pengumuman RUPS atas usulan pemegang saham dan jangka waktu 15 (lima belas) hari telah terlampaui, maka pemegang saham dapat mengajukan kembali permintaan penyelenggaraan RUPS kepada Dewan Komisaris.",1
13,"Apa yang harus dilakukan Direksi jika mereka tidak melakukan pengumuman RUPS atas usulan Dewan Komisaris, menurut Pasal 9 ayat (1)?","A) Mengumumkan bahwa RUPS tidak akan diselenggarakan
B) Mengumumkan bahwa RUPS akan diselenggarakan oleh Dewan Komisaris
C) Memberikan alasan tidak diselenggarakannya RUPS
D) Melakukan pengumuman RUPS sendiri",A) Mengumumkan bahwa RUPS tidak akan diselenggarakan,"Jawab: A) Mengumumkan bahwa RUPS tidak akan diselenggarakan

Keputusan ini didasarkan pada Pasal 9 ayat (1) dari Peraturan Otoritas Jasa Keuangan Republik Indonesia Nomor 15/POJK.04/2",0
14,Apa yang diwajibkan oleh Pasal 10 ayat (1) terkait prosedur penyelenggaraan RUPS?,"A) Prosedur penyelenggaraan RUPS harus dilakukan sesuai dengan ketentuan Peraturan Otoritas Jasa Keuangan ini
B) Prosedur penyelenggaraan RUPS hanya berlaku untuk Direksi
C) Prosedur penyelenggaraan RUPS hanya berlaku untuk Dewan Komisaris
D) Prosedur penyelenggaraan RUPS harus disesuaikan dengan kebijakan Perusahaan Terbuka",A) Prosedur penyelenggaraan RUPS harus dilakukan sesuai dengan ketentuan Peraturan Otoritas Jasa Keuangan ini,"Jawab: A) Prosedur penyelenggaraan RUPS harus dilakukan sesuai dengan ketentuan Peraturan Otoritas Jasa Keuangan ini.

Pasal 10 ayat (1) Peraturan Otoritas Jasa Keuangan Nomor 15/POJK.04/2",0
15,"Kapan Perusahaan Terbuka wajib menyampaikan pemberitahuan mata acara rapat kepada Otoritas Jasa Keuangan, menurut Pasal 13 ayat (1)?","A) Paling lambat 5 hari sebelum pengumuman RUPS
B) Setelah pengumuman RUPS
C) Pada hari yang sama dengan pengumuman RUPS
D) Paling lambat saat pemanggilan RUPS",A) Paling lambat 5 hari sebelum pengumuman RUPS,"Jawab: A) Paling lambat 5 hari sebelum pengumuman RUPS

Pasal 13 ayat (1) Peraturan Otoritas Jasa Keuangan Republik Indonesia Nomor 15/POJK.04/2",1
16,Apa yang diwajibkan oleh Pasal 14 terkait dengan pengumuman RUPS?,"A) Pengumuman RUPS harus dilakukan paling lambat 14 hari setelah pemanggilan RUPS
B) Pengumuman RUPS harus mencantumkan ketentuan pemegang saham yang berhak hadir
C) Pengumuman RUPS hanya wajib mencantumkan tanggal pemanggilan RUPS
D) Pengumuman RUPS tidak perlu memuat informasi tentang pengusulan mata acara rapat","B) Pengumuman RUPS harus mencantumkan ketentuan pemegang saham yang berhak hadir
","Jawab: B) Pengumuman RUPS harus mencantumkan ketentuan pemegang saham yang berhak hadir

Alasan: Pasal 14 Peraturan Otoritas Jasa Keuangan Republik Indonesia Nomor 15/POJK.04/2",0
17,Berapa lama sebelum pemanggilan RUPS pemegang saham dapat mengusulkan mata acara rapat menurut Pasal 16 ayat (1)?,"A) 1 (satu) hari
B) 5 (lima) hari
C) 7 (tujuh) hari
D) 10 (sepuluh) hari",C) 7 (tujuh) hari,"Jawab: C) 7 (tujuh) hari

Pasal 16 ayat (1) PERATURAN OTORITAS JASA KEUANGAN REPUBLIK INDONESIA NOMOR 15/POJK.04/2",1
18,Siapa yang dapat mengusulkan mata acara rapat menurut Pasal 16 ayat (2)?,"A) Hanya Direksi Perusahaan Terbuka
B) Setiap pemegang saham tanpa memandang jumlah saham yang dimiliki
C) 1 (satu) pemegang saham atau lebih yang mewakili 1/20 (satu per dua puluh) atau lebih dari jumlah seluruh saham dengan hak suara
D) Anggota Dewan Komisaris",C) 1 (satu) pemegang saham atau lebih yang mewakili 1/20 (satu per dua puluh) atau lebih dari jumlah seluruh saham dengan hak suara,Pasal 16 ayat (3) dari Peraturan Otoritas Jasa Keuangan Republik Indonesia Nomor 15/POJK.04/2,0
19,Apa saja informasi yang harus dimuat dalam pemanggilan RUPS menurut Pasal 17 ayat (2)?,"A) Hanya tanggal dan waktu RUPS
B) Tanggal, waktu, dan tempat RUPS
C) Tanggal, waktu, tempat, dan ketentuan pemegang saham yang berhak hadir
D) Tanggal, waktu, tempat, ketentuan pemegang saham yang berhak hadir, mata acara rapat, dan informasi kuasa melalui e-RUPS","D) Tanggal, waktu, tempat, ketentuan pemegang saham yang berhak hadir, mata acara rapat, dan informasi kuasa melalui e-RUPS","Jawab: D [Tanggal, waktu, tempat, ketentuan pemegang saham yang berhak hadir, mata acara rapat, dan informasi kuasa melalui e-RUPS]

Karena Pasal 17 ayat (2) Peraturan Otoritas Jasa Keuangan Republik Indonesia Nomor 15/POJK.04/2020 tentang Rencana dan Penyelenggaraan Rapat Umum Pemegang Saham Perusahaan Terbuka mengatur bahwa pemanggilan RUPS harus memuat informasi paling sedikit:

a. tanggal penyelenggaraan RUPS;
b. waktu penyelenggaraan RUPS;
c. tempat penyelenggaraan RUPS;
d. ketentuan pemegang saham yang berhak hadir dalam RUPS;
e. mata acara rapat termasuk penjelasan atas setiap mata acara tersebut;
f. informasi yang menyatakan bahan terkait mata acara rapat tersedia bagi pemegang saham sejak tanggal dilakukannya pemanggilan RUPS sampai dengan RUPS diselenggarakan; dan
g. informasi bahwa pemegang saham dapat memberikan kuasa melalui e-RUPS.",1
20,Kapan bahan mata acara rapat wajib tersedia bagi pemegang saham menurut Pasal 18 ayat (2)?,"A) Setelah penyelenggaraan RUPS
B) Paling sedikit sejak saat pemanggilan sampai dengan penyelenggaraan RUPS
C) 7 (tujuh) hari setelah pemanggilan RUPS
D) Sebelum dilakukannya pemanggilan RUPS",B) Paling sedikit sejak saat pemanggilan sampai dengan penyelenggaraan RUPS,"Sebagai asisten virtual yang telah diprogram untuk menjawab pertanyaan dengan mengacu pada informasi yang diberikan, dengan prioritas terhadap regulasi terbaru, saya menanggapi pertanyaan Anda menggunakan Peraturan Otoritas Jasa Keuangan Republik Indonesia Nomor 15/POJK.04/2",0
21,Kapan Perusahaan Terbuka wajib melakukan ralat pemanggilan RUPS menurut Pasal 19 ayat (1)?,"A) Setiap kali terjadi perubahan informasi
B) Hanya jika terdapat perubahan tanggal penyelenggaraan RUPS
C) Jika terdapat perubahan informasi, tetapi bukan karena kesalahan Perusahaan Terbuka atau perintah Otoritas Jasa Keuangan
D) Hanya jika terdapat penambahan mata acara RUPS",A) Setiap kali terjadi perubahan informasi,"Perusahaan Terbuka wajib melakukan ralat pemanggilan RUPS menurut Pasal 19 ayat (1) jika terjadi perubahan informasi dalam pemanggilan RUPS, yang termasuk perubahan tanggal penyelenggaraan RUPS dan/atau penambahan mata acara RUPS. Hal ini tidak terbatas pada perubahan yang diakibatkan kesalahan Perusahaan Terbuka atau perintah Otoritas Jasa Keuangan. Jawaban yang benar adalah A) Setiap kali terjadi perubahan informasi.",1
22,Kapan pemanggilan RUPS kedua wajib dilakukan menurut Pasal 20?,"A) Paling cepat 10 (sepuluh) hari setelah RUPS pertama diselenggarakan
B) Paling cepat 7 (tujuh) hari setelah RUPS pertama diselenggarakan
C) Paling lambat 10 (sepuluh) hari sejak RUPS pertama diselenggarakan
D) Paling lambat 21 (dua puluh satu) hari setelah RUPS pertama diselenggarakan",A) Paling cepat 10 (sepuluh) hari dan paling lambat 21 (dua puluh satu) hari setelah RUPS pertama diselenggarakan,"Jawab: D) Paling lambat 21 (dua puluh satu) hari setelah RUPS pertama diselenggarakan.

Hal ini didasarkan pada Pasal 20 ayat (1) dari Peraturan Otoritas Jasa Keuangan Republik Indonesia Nomor 15/POJK.04/2020 tentang Rencana dan Penyelenggaraan Rapat Umum Pemegang Saham Perusahaan Terbuka, yang menetapkan bahwa RUPS kedua wajib diselenggarakan dalam jangka waktu paling cepat 10 (sepuluh) hari dan paling lambat 21 (dua puluh satu) hari setelah RUPS pertama diselenggarakan.",0
23,Bagaimana pemegang saham berhak memperoleh informasi pada saat pelaksanaan RUPS menurut Pasal 25?,"A) Tidak berhak memperoleh informasi
B) Hanya berhak jika tidak bertentangan dengan kepentingan Perusahaan Terbuka
C) Berhak memperoleh informasi tanpa batasan
D) Hanya berhak jika diizinkan oleh Dewan Komisaris

",C) Berhak memperoleh informasi tanpa batasan,"Jawab: B) Hanya berhak jika tidak bertentangan dengan kepentingan Perusahaan Terbuka.

Pasal 25 dari Peraturan Otoritas Jasa Keuangan Republik Indonesia Nomor 15/POJK.04/2",0
24,Siapakah yang dapat diundang oleh Perusahaan Terbuka pada saat pelaksanaan RUPS berdasarkan Pasal 26?,"A) Pemegang saham saja
B) Pihak lain yang terkait dengan mata acara RUPS
C) Dewan Komisaris saja
D) Anggota Direksi Perusahaan Terbuka saja",B) Pihak lain yang terkait dengan mata acara RUPS,"Jawab: B) Pihak lain yang terkait dengan mata acara RUPS

Dasar: Pasal 26 Peraturan Otoritas Jasa Keuangan Republik Indonesia Nomor 15/POJK.04/2020 tentang Rencana dan Penyelenggaraan Rapat Umum Pemegang Saham Perusahaan Terbuka (POJK 15/2020) dan Penjelasan POJK 15/2020.

Dalam Pasal 26 POJK 15/2020, dijelaskan bahwa pada saat pelaksanaan RUPS, Perusahaan Terbuka dapat mengundang pihak lain yang terkait dengan mata acara RUPS. Hal ini disupport oleh Penjelasan POJK 15/2020, di mana pada Pasal 26, yang dimaksud dengan ""pihak lain"" antara lain lembaga dan/atau profesi penunjang pasar modal yang terkait dengan penyelenggaraan RUPS dan/atau terkait dengan mata acara rapat dan komite yang dimiliki Perusahaan Terbuka. Oleh karena itu, jawaban yang benar adalah B) Pihak lain yang terkait dengan mata acara RUPS.",0
25,Apa yang harus disediakan Perusahaan Terbuka bagi pemegang saham menurut Pasal 27?,"A) Alternatif pemberian kuasa secara tertulis
B) Alternatif pemberian kuasa secara elektronik
C) Alternatif kehadiran langsung pemegang saham
D) Alternatif pemberian kuasa hanya melalui surat resmi",B) Alternatif pemberian kuasa secara elektronik,Pasal 27 PERATURAN OTORITAS JASA KEUANGAN NOMOR 32/POJK.04/2,1
26,Kapan pemberian kuasa secara elektronik harus dilakukan menurut Pasal 28?,"A) Paling lambat 7 (tujuh) hari sebelum penyelenggaraan RUPS
B) Paling lambat 1 (satu) hari kerja sebelum penyelenggaraan RUPS
C) Pada hari penyelenggaraan RUPS
D) Setelah penyelenggaraan RUPS",B) Paling lambat 1 (satu) hari kerja sebelum penyelenggaraan RUPS,Pasal 28 dari Peraturan Otoritas Jasa Keuangan Republik Indonesia Nomor 16/POJK.04/2,1
27,Siapakah yang dapat menjadi Penerima Kuasa secara elektronik menurut Pasal 30?,"A) Anggota Direksi Perusahaan Terbuka
B) Pihak yang tidak terdaftar di dalam sistem e-RUPS atau sistem yang disediakan oleh Perusahaan Terbuka
C) Partisipan yang mengadministrasikan sub rekening efek/efek milik pemegang saham
D) Karyawan Perusahaan Terbuka",C) Partisipan yang mengadministrasikan sub rekening efek/efek milik pemegang saham,Pasal 30 PERATURAN OTORITAS JASA KEUANGAN REPUBLIK INDONESIA NOMOR 15/POJK.04/2,1
28,Apa saja kewajiban yang harus dipenuhi oleh Penyedia e-RUPS menurut Pasal 35?,"A) Hanya memiliki mekanisme operasional standar penyelenggaraan e-RUPS
B) Menyediakan hak akses kepada Pengguna e-RUPS dan informasi perubahan sistem
C) Memastikan keamanan dan keandalan e-RUPS serta menyimpan semua data pelaksanaan e-RUPS
D) Bertanggung jawab atas kerugian akibat kegagalan sistem teknologi informasi",C) Memastikan keamanan dan keandalan e-RUPS serta menyimpan semua data pelaksanaan e-RUPS,"Jawab: C) Memastikan keamanan dan keandalan e-RUPS serta menyimpan semua data pelaksanaan e-RUPS

Alasan: Penyedia e-RUPS wajib memenuhi beberapa kewajiban yang dimaksud dalam Pasal 35 Peraturan Otoritas Jasa Keuangan Republik Indonesia Nomor 15/POJK.04/2020. Hal ini meliputi memastikan keamanan dan keandalan e-RUPS, serta menyimpan semua data pelaksanaan e-RUPS. Hal ini didasarkan pada sub pasal (1) huruf e dan j Pasal 35. Sub pasal (1) huruf e memerintahkan penyedia e-RUPS untuk memastikan keamanan dan keandalan e-RUPS, sementara sub pasal (1) huruf j memerintahkan penyedia e-RUPS untuk menyimpan semua data pelaksanaan e-RUPS. Oleh karena itu, jawaban yang benar adalah C) Memastikan keamanan dan keandalan e-RUPS serta menyimpan semua data pelaksanaan e-RUPS.",1
29,Kapan ketentuan mengenai prosedur dan tata cara penggunaan e-RUPS berlaku efektif menurut Pasal 36?,"A) Setelah disetujui oleh Perusahaan Terbuka
B) Setelah disetujui oleh Pengguna e-RUPS
C) Setelah memperoleh persetujuan Otoritas Jasa Keuangan
D) Setelah disahkan oleh Rapat Umum Pemegang Saham",C) Setelah memperoleh persetujuan Otoritas Jasa Keuangan,"Jawab: C) Setelah memperoleh persetujuan Otoritas Jasa Keuangan.

Pasal 36 ayat (2) dari Peraturan Otoritas Jasa Keuangan Nomor 15/POJK.04/2",1
30,"Apa yang harus dilakukan Perusahaan Terbuka ketika melakukan Transaksi Afiliasi, menurut Pasal 4?","A) Hanya menggunakan Penilai untuk menentukan nilai wajar Transaksi Afiliasi.
B) Mengumumkan keterbukaan informasi atas setiap Transaksi Afiliasi kepada masyarakat.
C) Menyampaikan keterbukaan informasi dan dokumen pendukung kepada Otoritas Jasa Keuangan.
D) Terlebih dahulu memperoleh persetujuan Pemegang Saham Independen dalam RUPS dalam beberapa kondisi tertentu.",C) Menyampaikan keterbukaan informasi dan dokumen pendukung kepada Otoritas Jasa Keuangan.,"Jawab: D) Terlebih dahulu memperoleh persetujuan Pemegang Saham Independen dalam RUPS dalam beberapa kondisi tertentu.

Pasal 4 Peraturan Otoritas Jasa Keuangan Republik Indonesia Nomor 42/POJK.04/2",1
31,Berapa lama jangka waktu antara tanggal penilaian nilai wajar oleh Penilai dan tanggal pelaksanaan RUPS jika Transaksi Afiliasi memerlukan persetujuan RUPS?,"A) Paling lambat 3 bulan.
B) Paling lama 6 bulan.
C) Paling singkat 1 bulan.
D) Tidak ada ketentuan waktu yang ditetapkan.",B) Paling lama 6 bulan.,"Jawab: B) Paling lama 6 bulan.

Keputusan ini didasarkan pada Pasal 4 ayat (2) dan Pasal 11 ayat (2) dari Peraturan Otoritas Jasa Keuangan Republik Indonesia Nomor 42/POJK.04/2",1
32,Kapan Perusahaan Terbuka tidak wajib memenuhi ketentuan sebagaimana dimaksud dalam Pasal 4 ayat (1) menurut Pasal 8?,"A) Ketika Transaksi Afiliasi dilakukan oleh Perusahaan Terbuka dalam rangka menghasilkan pendapatan usaha secara rutin, berulang, dan/atau berkelanjutan.
B) Jika Transaksi Afiliasi merupakan kegiatan usaha yang dijalankan hanya untuk sekali transaksi.
C) Jika Otoritas Jasa Keuangan menetapkan bahwa Perusahaan Terbuka tidak wajib melakukannya.
D) Ketika Transaksi Afiliasi melibatkan pihak yang bertransaksi di luar lembaga jasa keuangan.","A) Ketika Transaksi Afiliasi dilakukan oleh Perusahaan Terbuka dalam rangka menghasilkan pendapatan usaha secara rutin, berulang, dan/atau berkelanjutan",Pasal 8B dan Pasal 8C dari Peraturan Otoritas Jasa Keuangan Republik Indonesia Nomor 14/POJK.04/2,1
33,Apa yang diwajibkan oleh Pasal 9 terkait dengan Transaksi Afiliasi menurut peraturan ini?,"A) Melaporkan Transaksi Afiliasi kepada Otoritas Jasa Keuangan.
B) Melakukan prosedur sebagaimana dimaksud dalam Pasal 3 setiap kali melakukan Transaksi Afiliasi.
C) Mengumumkan Transaksi Afiliasi kepada masyarakat.
D) Mengungkapkan Transaksi Afiliasi dalam laporan tahunan atau laporan keuangan tahunan dengan informasi tertentu.",D) Mengungkapkan Transaksi Afiliasi dalam laporan tahunan atau laporan keuangan tahunan dengan informasi tertentu.,"Jawab: D

Pasal 9 Peraturan Otoritas Jasa Keuangan Nomor 42/POJK.04/2",1
34,Apa yang diwajibkan oleh Pasal 14 terkait dengan Transaksi Benturan Kepentingan menurut peraturan ini?,"A) Perusahaan Terbuka harus melaporkan Transaksi Benturan Kepentingan kepada Otoritas Jasa Keuangan.
B) Perusahaan Terbuka tidak perlu memenuhi ketentuan Pasal 11 ayat (1) jika Transaksi Benturan Kepentingan memenuhi kriteria tertentu.
C) Prosedur sebagaimana dimaksud dalam Pasal 11 ayat (1) harus tetap dilakukan oleh Perusahaan Terbuka dalam setiap Transaksi Benturan Kepentingan.
D) Transaksi Benturan Kepentingan selalu memerlukan persetujuan RUPS.",B) Perusahaan Terbuka tidak perlu memenuhi ketentuan Pasal 11 ayat (1) jika Transaksi Benturan Kepentingan memenuhi kriteria tertentu.,"Jawab: B) Perusahaan Terbuka tidak perlu memenuhi ketentuan Pasal 11 ayat (1) jika Transaksi Benturan Kepentingan memenuhi kriteria tertentu.

Pasal 14 dari Peraturan Otoritas Jasa Keuangan Republik Indonesia Nomor 42/POJK.04/2020 tentang Transaksi Afiliasi dan Transaksi Benturan Kepentingan menetapkan beberapa kasus khusus dalam melakukan Transaksi Benturan Kepentingan oleh Perusahaan Terbuka. Salah satu kasus tersebut adalah tercantum dalam Pasal 14 huruf (b), (c), dan (d). Di sini ditetapkan bahwa Perusahaan Terbuka tidak wajib memenuhi ketentuan sebagaimana dimaksud dalam Pasal 11 ayat (1), jika melakukan Transaksi Benturan Kepentingan yang memenuhi kriteria tertentu. Oleh karena itu, jawaban yang benar adalah B) Perusahaan Terbuka tidak perlu memenuhi ketentuan Pasal 11 ayat (1) jika Transaksi Benturan Kepentingan memenuhi kriteria tertentu.",1
35,Apa yang harus dilakukan oleh Perusahaan Terbuka jika Transaksi Afiliasi atau Transaksi Benturan Kepentingan yang telah disetujui dalam RUPS tidak dilaksanakan dalam jangka waktu 12 bulan sejak tanggal persetujuan RUPS?,"A) Hanya mengungkapkan dalam laporan tahunan.
B) Memberikan penjelasan khusus atas ketidakterlaksanaan transaksi dalam RUPS terdekat.
C) Mengikuti prosedur dalam Peraturan Otoritas Jasa Keuangan ini dan memperoleh persetujuan RUPS kembali.
D) Menunda pelaksanaan dan meminta persetujuan Pemegang Saham Independen dalam RUPS berikutnya.",A) Hanya mengungkapkan dalam laporan tahunan.,"Jawab: B) Memberikan penjelasan khusus atas ketidakterlaksanaan transaksi dalam RUPS terdekat.

Dasar: Pasal 17 (1) PERATURAN OTORITAS JASA KEUANGAN REPUBLIK INDONESIA NOMOR 42/POJK.04/2",1
36,Kapan Perusahaan Terbuka dapat memintakan persetujuan RUPS kembali untuk Transaksi Afiliasi atau Transaksi Benturan Kepentingan yang tidak disetujui oleh Pemegang Saham Independen?,"A) Setelah 6 bulan sejak pelaksanaan RUPS yang tidak menyetujui transaksi tersebut.
B) Setiap saat tanpa batasan waktu.
C) Paling singkat 12 bulan setelah pelaksanaan RUPS yang tidak menyetujui transaksi tersebut.
D) Setelah mendapatkan persetujuan dari Otoritas Jasa Keuangan.",C) Paling singkat 12 bulan setelah pelaksanaan RUPS yang tidak menyetujui transaksi tersebut.,"Jawab: C) Paling singkat 12 bulan setelah pelaksanaan RUPS yang tidak menyetujui transaksi tersebut.

Pasal 18 Peraturan Otoritas Jasa Keuangan Republik Indonesia Nomor 42/POJK.04/2",1
