,answer,ans_grth,score
35,"Pasal 6 Peraturan Otoritas Jasa Keuangan menyatakan bahwa selain sanksi administratif sebagaimana dimaksud dalam Pasal 5 ayat (1), Otoritas Jasa Keuangan dapat melakukan tindakan tertentu terhadap setiap pihak yang melakukan pelanggaran ketentuan Peraturan Otoritas Jasa Keuangan ini. Pasal 7 menyatakan bahwa Otoritas Jasa Keuangan dapat mengumumkan pengenaan sanksi administratif sebagaimana dimaksud dalam Pasal 5 ayat (1) dan tindakan tertentu selain sanksi administratif. Hal lain yang dapat dilakukan oleh Otoritas Jasa Keuangan adalah tindakan tertentu yang ditetapkan dalam peraturan perundang-undangan lain yang berlaku.

Sanksi administratif yang dapat dikenakan oleh Otoritas Jasa Keuangan meliputi peringatan tertulis dan denda. Sanksi administratif dapat dikenakan dengan atau tanpa didahului pengenaan sanksi administratif berupa peringatan tertulis.

Dalam konteks lain, Pasal 9 Peraturan Otoritas Jasa Keuangan menyatakan bahwa selain sanksi administratif sebagaimana dimaksud dalam Pasal 8 ayat (1), Otoritas Jasa Keuangan dapat melakukan tindakan tertentu terhadap setiap pihak yang melakukan pelanggaran ketentuan Peraturan Otoritas Jasa Keuangan ini. Pasal 10 menyatakan bahwa Otoritas Jasa Keuangan dapat mengumumkan pengenaan sanksi administratif sebagaimana dimaksud dalam Pasal 8 ayat (1) dan tindakan tertentu sebagaimana dimaksud dalam Pasal 9 kepada masyarakat.

Jadi, selain dapat mengenaikan sanksi administratif, Otoritas Jasa Keuangan juga dapat melakukan tindakan tertentu lainnya terhadap pihak yang melanggar ketentuan peraturan yang dikeluarkannya.","
Selain sanksi administratif sebagaimana dimaksud dalam Pasal 15 ayat (4), Otoritas Jasa Keuangan dapat melakukan tindakan tertentu terhadap setiap pihak yang melakukan pelanggaran ketentuan Peraturan Otoritas Jasa Keuangan ini.",1
36,"Perusahaan Publik, sebagaimana dimaksud dalam konteks yang Anda berikan, adalah perseroan terbatas yang sahamnya telah dimiliki oleh sekurang-kurangnya 300 pemegang saham dan memiliki modal disetor sekurang-kurangnya Rp3.000.000.000,00 atau suatu jumlah pemegang saham dan modal disetor yang ditetapkan oleh Peraturan Pemerintah. Arti dari istilah ini dapat ditemukan dalam beberapa konteks, yaitu:

1. Konteks pertama, istilah Perusahaan Publik didefinisikan dalam hal memiliki minimal 300 pemegang saham dan modal disetor sekurang-kurangnya Rp3.000.000.000,00.
2. Konteks kedua, Perusahaan Publik didefinisikan sebagai salah satu syarat untuk melakukan Penawaran Umum.
3. Konteks ketiga, Perusahaan Publik didefinisikan sebagai salah satu syarat untuk membuat Surat Pernyataan Direksi mengenai Tanggung Jawab atas Laporan Keuangan.
4. Konteks keempat, Perusahaan Publik didefinisikan sebagai salah satu subjek dari Prinsip Keterbukaan.

Secara ringkas, Perusahaan Publik dapat kita definisikan sebagai perseroan terbatas yang telah melakukan Penawaran Umum, memiliki minimal 300 pemegang saham, dan memiliki modal disetor sekurang-kurangnya Rp3.000.000.000,00 atau suatu jumlah pemegang saham dan modal disetor yang ditetapkan oleh Peraturan Pemerintah.","
Selain sanksi administratif sebagaimana dimaksud dalam Pasal 15 ayat (4), Otoritas Jasa Keuangan dapat melakukan tindakan tertentu terhadap setiap pihak yang melakukan pelanggaran ketentuan Peraturan Otoritas Jasa Keuangan ini.",1
37,"Pasal 2 dari Peraturan Otoritas Jasa Keuangan mengatur bahwa Situs Web adalah kumpulan halaman web yang memuat informasi atau data yang dapat diakses melalui suatu sistem jaringan internet.

Dalam konteks ini, situs web digunakan sebagai alat untuk mengumumkan informasi atau fakta material yang dapat mempengaruhi harga efek pada bursa efek dan atau keputusan pemodal, calon pemodal, atau pihak lain yang berkepentingan atas informasi atau fakta tersebut. Hal ini berlaku bagi emiten skala kecil dan emiten skala menengah, serta perusahaan terbuka yang sahamnya tidak tercatat pada bursa efek.

Situs web emiten atau perusahaan publik wajib memuat informasi dalam bahasa Indonesia dan bahasa asing, dengan ketentuan bahasa asing yang digunakan paling sedikit bahasa Inggris. Selain itu, situs web bursa efek atau surat kabar harian berbahasa Indonesia yang berperedaran nasional juga dapat digunakan untuk mengumumkan informasi.

Pasal 28 menetapkan bahwa ketentuan pengumuman melalui situs web yang disediakan oleh Otoritas Jasa Keuangan ditetapkan oleh Otoritas Jasa Keuangan. Hal ini berlaku dalam hal pengumuman transaksi material dan perubahan kegiatan usaha.

Selain itu, Pasal 20 menetapkan bahwa emiten atau perusahaan publik yang efeknya tercatat pada bursa efek wajib mengumumkan laporan keuangan berkala melalui situs web bursa efek, sedangkan emiten atau perusahaan publik yang efeknya tidak tercatat pada bursa efek wajib mengumumkan laporan keuangan berkala melalui surat kabar harian berbahasa Indonesia yang beredar secara nasional atau situs web yang disediakan Otoritas Jasa Keuangan.","
Situs Web adalah kumpulan halaman web yang memuat informasi atau data yang dapat diakses melalui suatu sistem jaringan internet.",1
38,"Sistem keuangan, sebagaimana dimaksud dalam Peraturan Otoritas Jasa Keuangan tentang Penyelenggaraan Kegiatan di Bidang Pasar Modal, adalah rangkaian institusi, mekanisme, dan alat yang saling terkait dan berinteraksi, serta didukung oleh hukum dan peraturan, yang digunakan untuk mengelola dan mengalokasikan sumber daya keuangan. Ini meliputi berbagai sektor, seperti perbankan, pasar modal, asuransi, dan manajemen investasi, serta mencakup aspek moneter, finansial, dan kapital. Selain itu, sistem keuangan juga termasuk pengawasan dan regulasi yang diperlukan untuk memastikan efisiensi, transparansi, dan keamanan dalam transaksi keuangan.","
Sistem Keuangan adalah suatu kesatuan yang terdiri atas lembaga jasa keuangan, pasar keuangan, dan infrastruktur keuangan, termasuk sistem pembayaran, yang berinteraksi dalam memfasilitasi pengumpulan dana masyarakat dan pengalokasiannya untuk mendukung aktivitas perekonomian nasional, serta korporasi dan rumah tangga yang terhubung dengan lembaga jasa keuangan.",0.5
39,"Based on the provided context, the relevant regulation is the Financial Services Authority Regulation (POJK) Number 23/POJK.04/2016 about Collective Investment Contract Funds (hereinafter referred to as ""POJK 23/POJK.04/2016""), as amended by POJK Number 2/POJK.04/2020 about the Second Amendment to POJK Number 23/POJK.04/2016 about Collective Investment Contract Funds (hereinafter referred to as ""POJK 2/POJK.04/2020"").

The Collective Investment Contract Funds are regulated by the aforementioned regulations, which are based on the Indonesian Capital Market Law Number 8 Year 1995 (hereinafter referred to as ""Law 8/1995""). Law 8/1995 is the fundamental legislation that provides the basis for the establishment and operation of the capital market in Indonesia, including collective investment contract funds.

Therefore, the Collective Investment Contract Funds are established and operated based on the provisions of Law 8/1995, as implemented and detailed in POJK 23/POJK.04/2016 and POJK 2/POJK.04/2020.","
Undang-Undang ini dilaksanakan berdasarkan asas: a. kepentingan nasional; b. kemanfaatan; c. kepastian hukum; d. keterbukaan; e. akuntabilitas; e. akuntabilitas; f. keadilan; g. Pelindungan Konsumen; h. edukasi; dan i. keterpaduan.",0
40,"Saya akan menjawab pertanyaan Anda berdasarkan informasi yang tersedia dalam context yang diberikan.

Undang-Undang Nomor 4 Tahun 2023 tentang Pengembangan dan Penguatan Sektor Keuangan (Lembaran Negara Republik Indonesia Tahun 2","
(1) Undang-Undang ini dibentuk dengan maksud mendorong kontribusi sektor keuangan bagi pertumbuhan ekonorni yang inklusif, berkelanjutan, dan berkeadilan guna meningkatkan taraf hidup masyarakat, mengurangi ketimpangan ekonomi, dan mewujudkan Indonesia yang sejahtera, maju, dan bermartabat. (21 Undang-Undang ini dibentuk dengan tujuan untuk: a. mengoptimalkan fungsi intermediasi sektor keuangan kepada usaha sektor produktif; b. meningkatkan portofolio pendanaan terhadap sektor usaha yang produktif; c. meningkatkan kemudahan akses dan literasi terkait jasa keuangan; d. meningkatkan dan memperluas inklusi sektor keuangan; e. memperluas sumber pembiayaan jangka panjang; f. meningkatkan daya saing dan efisiensi sektor keuangan; g. mengembangkan instrumen di pasar keuangan dan memperkuat mitigasi risiko; h. meningkatkan pembinaan, pengawasa.n, dan Pelindungan Konsumen; i. memperkuat pelindungan atas data pribadi nasabah sektor keuangan; j. memperkuat kelembagaan dan ketahanan Stabilitas Sistem Keuangan; k. mengembangkan dan memperkuat ekosistem sektor keuangan; 1. memperkuat wewenang, tanggung jawab, tugas, dan fungsi regulator sektor keuangan; dan m. meningkatkan daya saing masyarakat sehingga dapat berusaha secara efektif dan efisien.",1
41,"Based on the provided context, the scope of the Law on the Development and Strengthening of the Financial Sector can be summarized as follows:

Undang-Undang Nomor 4 Tahun 2023 tentang Pengembangan dan Penguatan Sektor Keuangan (Law No. 4 of 2023 on the Development and Strengthening of the Financial Sector) aims to support the development and strengthening of the financial sector in Indonesia. This law is in line with the increasingly complex and diverse financial services industry, a rapidly moving national and international economy, a competitive and integrated financial system, and an increasingly advanced financial system. The law underlines the importance of effective law enforcement in the financial services sector.

The law also supports the implementation of anti-money laundering, counter-terrorism financing, and counter-proliferation financing programs in the financial sector. This is in accordance with the global efforts to prevent and combat TPPU, TPPT, and PPSPM, which are based on FATF Recommendations. The regulation also serves as an enhancement of the Otoritas Jasa Keuangan Regulation No. 12/POJK.01/2017, as amended by Otoritas Jasa Keuangan Regulation No. 23/POJK.01/2019.

In summary, the Law on the Development and Strengthening of the Financial Sector focuses on enhancing the financial sector in Indonesia, supporting effective law enforcement, and implementing anti-money laundering, counter-terrorism financing, and counter-proliferation financing programs in the financial sector.","
ruang lingkup dalam Undang-Undang ini mengatur ekosistem sektor keuangan meliputi: a. kelembagaan; b. perbankan; c. Pasar Modal, Pasar Uang, dan Pasar Valuta Asing; d. perasuransian dan penjaminan; e. asuransi Usaha Bersama; f. program penjaminan polis; g. Usaha Jasa Pembiayaan; h. kegiatan usaha bulion (bullionl; i. Dana Pensiun, program jaminan hari tua, dan program pensiun; j. kegiatan koperasi di sektor jasa keuangan; k. lembaga keuangan mikro; l. Konglomerasi Keuangan; m. ITSK; n. penerapan Keuangan Berkelanjutan; o. Literasi Keuangan, Inklusi Keuangan, dan Pelindungan Konsumen; p. akses pembiayaan Usaha Mikro, Kecil, dan Menengah; q. sumber daya manusia; r. Stabilitas Sistem Keuangan; s. lembaga pembiayaan ekspor Indonesia; dan t. penegakan hukum di sektor keuangan.",0
42,"Based on the provided context, the purpose or objective of Bank Indonesia can be derived from the definition of the financial services sector in Undang-Undang Nomor 21 Tahun 2","
Tujuan Bank Indonesia adalah mencapai stabilitas nilai rupiah, memelihara stabilitas Sistem Pembayaran, dan turut menjaga Stabilitas Sistem Keuangan dalam rangka mendukung pertumbuhan ekonomi yang berkelanjutan.",0
43,"Dalam context yang disediakan, deposito didefinisikan sebagai jenis aset yang ditempatkan di bank, baik itu bank dalam negeri maupun luar negeri. Ada beberapa jenis deposito yang disebutkan dalam context ini, yaitu:

1. Deposito bank umum yang jatuh tempo kurang dari atau sama dengan 3 (tiga) bulan sejak tanggal laporan MKBD.
2. Deposito bank umum yang jatuh tempo lebih dari 3 (tiga) bulan sejak tanggal laporan MKBD, yang dikelompokkan menjadi dua, yaitu:
a. Deposito bank umum yang memenuhi kriteria sebagai simpanan yang dijamin oleh Lembaga Penjamin Simpanan.
b. Deposito bank umum yang tidak memenuhi kriteria sebagai simpanan yang dijamin oleh Lembaga Penjamin Simpanan.
3. Deposito berjangka yang dijaminkan ke bank dengan kondisi tertentu, seperti untuk mendapatkan pinjaman jangka pendek atau untuk kepentingan modal kerja Perusahaan Efek.
4. Deposito pada bank perkreditan rakyat.

Dalam peraturan yang berlaku di Indonesia, deposito merupakan jenis aset yang terproteksi oleh Lembaga Penjamin Simpanan (LPS). LPS menjamin setiap deposito yang ditempatkan di bank yang berlokasi di Indonesia, sehingga setiap depositor akan mendapatkan pengembalian dana yang terjamin sampai batas nilai penjaminan yang ditetapkan oleh LPS.

Nama peraturan yang mengatur tentang deposito bank di Indonesia antara lain:

1. Peraturan Otoritas Jasa Keuangan No. 16/POJK.03/2014 tentang Deposito Bank.
2. Peraturan LPS No. 1/LPS/2013 tentang Penjaminan Deposito.

Semoga jawaban ini dapat membantu Anda.","
""Deposito adalah Simpanan berdasarkan Akad
mudharabah atau Akad lain yang tidak bertentangan
dengan Prinsip Syariah yang penarikannya hanya
dapat dilakukan pada waktu tertentu berdasarkan
Akad antara Nasabah Penyimpan dan Bank Syariah
dan/atau UUS.",1
44,"Dalam context yang disediakan, Otoritas Jasa Keuangan Republik Indonesia (OJK) didefinisikan sebagai lembaga yang memiliki fungsi sebagai regulator sektor jasa keuangan, yang salah satunya bidangnya adalah pasar modal. OJK berperan dalam mengatur dan mengawasi terselenggaranya pasar modal secara teratur, adil, transparan, akuntabel, berkelanjutan dan stabil, serta melindungi kepentingan para investor khususnya pemegang saham publik. Selain itu, OJK juga berwenang melakukan tindakan pencegahan kerugian, pelayanan pengaduan Konsumen, serta melakukan pembelaan hukum untuk melindungi kepentingan Konsumen dan masyarakat di sektor jasa keuangan.

Dalam Peraturan Otoritas Jasa Keuangan Nomor 29 /POJK.04/2021, OJK mempunyai wewenang pengaturan, seperti menetapkan persyaratan dan tata cara Pernyataan Pendaftaran, penundaan, pembatalan, atau pencabutan efektifnya Pernyataan Pendaftaran, serta penundaan Penawaran Umum. OJK juga mempunyai kewenangan mengatur persyaratan pemilikan saham dan/atau pengendalian Pihak yang memperoleh izin, persetujuan, atau pendaftaran dari OJK, serta mengatur kewajiban penerbitan Efek dan konversi Efek.

Hal ini diatur dalam Undang-Undang Nomor 21 Tahun 2011 tentang Otoritas Jasa Keuangan (UU OJK) dan Peraturan Otoritas Jasa Keuangan Nomor 1/POJK.07/2013 tentang Perlindungan Konsumen Sektor Jasa Keuangan.","""
Otoritas Jasa Keuangan adalah lembaga negara yang independen yang mempunyai fungsi, tugas, dan wewenang pengaturan, pengawasan, pemeriksaan, dan penyidikan sebagaimana dimaksud dalam undang-undang mengenai Otoritas Jasa Keuangan.",0
45,"Based on the provided context, Perusahaan Efek (Securities Company) or Penasihat Investasi (Investment Adviser) in Indonesia are prohibited from certain activities to protect the interests of their clients. Here are some of the key regulations:

1. Peraturan Pemerintah (Government Regulation) No. 23/2021, Article 35:

c. Perusahaan Efek atau Penasihat Investasi wajib secara benar dan sejujurnya mengungkapkan Fakta Material untuk diketahui oleh nasabah mengenai kemampuan profesi serta keadaan keuangannya.

This means that both Securities Companies and Investment Advisers are obliged to honestly and accurately disclose material facts to their clients about their professional capabilities and financial condition.

1. Peraturan Pemerintah (Government Regulation) No. 34/2021, Article 1:

dalam hal Perusahaan Efek atau Penasihat Investasi mempunyai kepentingan dalam suatu Efek bersamaan dengan nasabahnya, mereka wajib memberitahukan hal tersebut kepada nasabahnya sebelum memberikan rekomendasi.

This means that if Securities Companies or Investment Advisers have an interest in a particular security that is the same as their clients, they must disclose this to their clients before making a recommendation.

1. Peraturan Pemerintah (Government Regulation) No. 33/2021, Article 35(c):

Sebagai Pihak yang memperoleh kepercayaan dari nasabahnya, Perusahaan Efek atau Penasihat Investasi wajib secara benar dan sejujurnya mengungkapkan Fakta Material untuk diketahui oleh nasabah mengenai kemampuan profesi serta keadaan keuangannya.

This regulation is similar to the one mentioned earlier, emphasizing the obligation of Securities Companies and Investment Advisers to honestly and accurately disclose material facts to their clients about their professional capabilities and financial condition.

In summary, Perusahaan Efek or Penasihat Investasi in Indonesia are prohibited from making false or incomplete statements about their abilities or financial situation, from failing to disclose conflicts of interest, and from making recommendations without disclosing their interests in the relevant securities. These regulations are in place to protect the interests of clients and maintain the integrity of the capital market.","
Perusahaan Efek atau Penasihat Investasi dilarang: a. menggunakan pengaruh atau mengadakan tekanan yang bertentangan dengan kepentingan nasabah; b. mengungkapkan b. mengungkapkan nama atau kegiatan nasabah, kecuali diberi instruksi secara tertulis oleh nasabah atau diwajibkan menurut peraturan perundang-undangan yang berlaku; c. mengemukakan secara tidak benar atau tidak mengemukakan fakta yang material kepada nasabah mengenai kemampuan usaha atau keadaan keuangannya; d. merekomendasikan kepada nasabah untuk membeli atau menjual Efek tanpa memberitahukan adanya kepentingan Perusahaan Efek dan Penasihat Investasi dalam Efek tersebut; atau e. membeli atau memiliki Efek untuk rekening Perusahaan Efek itu sendiri atau untuk rekening Pihak terafiliasi jika terdapat kelebihan permintaan beli dalam Penawaran Umum dalam hal Perusahaan Efek tersebut bertindak sebagai Penjamin Emisi Efek atau agen penjualan, kecuali pesanan Pihak yang tidak terafiliasi telah terpenuhi seluruhnya.",0.5
46,"Based on the provided context, Perusahaan Efek (Securities Company) or Penasihat Investasi (Investment Advisor) have several obligations according to the regulations. Here are some of them:

1. According to President of the Republic of Indonesia Regulation No. 34, Article 35, Perusahaan Efek or Penasihat Investasi must prioritize and protect the interests of their clients, as long as it does not conflict with the applicable laws and regulations. They must also avoid any actions that are against the interests of their clients.
2. Based on President of the Republic of Indonesia Regulation No. 34, Article 36 (a) and (b), Perusahaan Efek or Penasihat Investasi must understand the background, financial condition, and investment objectives of their clients. By knowing this information, they can provide advice that suits the client's condition and avoid any misuse of trust for their own interests.
3. According to President of the Republic of Indonesia Regulation No. 34, Article 37 (a) and (b), Perusahaan Efek that receives Efek (shares) from their clients must keep the shares in a separate account from the company's account. They must also maintain separate books for each client and provide a safe storage place for their clients' assets according to the rules set by Bapepam (Financial Services Authority).
4. Based on President of the Republic of Indonesia Regulation No. 34, Article 38, Perusahaan Efek that acts as a Securities Trading Intermediary is prohibited from conducting transactions on behalf of affiliated parties or for their own interests if non-affiliated clients from the company have given instructions.
5. According to President of the Republic of Indonesia Regulation No. 34, Article 36 (a) and (b), if there is an oversubscription in a Public Offering, Perusahaan Efek that acts as a Guaranteed Underwriter must prioritize the interests of other non-affiliated parties who have ordered shares before their own interests, the seller's interests, and all affiliated parties.

In summary, Perusahaan Efek or Penasihat Investasi have obligations to prioritize and protect their clients' interests, understand their clients' background and investment objectives, keep their clients' shares in a separate account, maintain separate books for each client, provide a safe storage place for their clients' assets, avoid any actions that are against their clients' interests, and prioritize the interests of other non-affiliated parties in case of oversubscription in a Public Offering.","
a. mengetahui latar belakang, keadaan keuangan, dan tujuan investasi nasabahnya; dan b. membuat dan menyimpan catatan dengan baik mengenai pesanan, transaksi, dan kondisi keuangannya",1
47,"Pasal 13, Pasal 14, Pasal 25, dan Pasal 26 dari Informasi yang Anda berikan menjelaskan mengenai Kustodian. Kustodian adalah pihak yang memberikan jasa penitipan Efek dan harta lain yang berkaitan dengan Efek, termasuk menerima dividen, bunga, dan hak-hak lain, menyelesaikan transaksi Efek, dan mewakili pemegang rekening yang menjadi nasabahnya. Kustodian dapat berupa perusahaan efek yang menjalankan kegiatan usaha sebagai Perantara Pedagang Efek dan bank Kustodian. Untuk dapat menjadi Kustodian, perusahaan efek atau bank tersebut harus memperoleh persetujuan dari Otoritas Jasa Keuangan.

Demikianlah jawabannya. Semoga bermanfaat.","
Kustodian adalah Pihak yang memberikan jasa penitipan Efek dan harta lain yang berkaitan dengan Efek serta jasa lain, termasuk menerima dividen, bunga, dan hak-hak lain, menyelesaikan transaksi Efek, dan mewakili pemegang rekening yang menjadi nasabahnya.",1
48,"Tujuan dari Bursa Efek, sebagaimana dimaksud dalam Pasal 7 ayat (1) Undang-Undang Nomor 8 Tahun 1995 tentang Pasar Modal, adalah menyelenggarakan perdagangan Efek yang teratur, wajar, dan efisien. Hal ini diimplementasikan dengan menyediakan sistem dan/atau sarana untuk mempertemukan penawaran jual dan beli Efek antara pihak yang berminat, serta mengawasi kegiatan Anggota Bursa Efek. Selain itu, Bursa Efek juga wajib menyediakan sarana pendukung dan mengawasi kegiatan Anggota Bursa Efek, sehingga dapat mencapai tujuan yang telah ditetapkan.

Sumber:
Undang-Undang Nomor 8 Tahun 1995 tentang Pasar Modal
Pasal 7 ayat (1)
Pasal 8
Pasal 9

Dalam konteks yang Anda berikan, tujuan dari Bursa Efek dapat dilihat pada Pasal 7 ayat (1) Undang-Undang Nomor 8 Tahun 1995 tentang Pasar Modal, yang telah saya sampaikan di atas.","
Bursa Efek didirikan dengan tujuan menyelenggarakan perdagangan Efek yang teratur, wajar, dan efisie",1
49,"Pasal 43 (1) Peraturan Pemerintah Nomor 9 Tahun 2018 tentang Lembaga Penunjang Pasar Modal menetapkan bahwa yang dapat menyelenggarakan kegiatan usaha sebagai Kustodian adalah Lembaga Penyimpanan dan Penyelesaian, Perusahaan Efek, atau Bank Umum yang telah mendapat persetujuan Otoritas Jasa Keuangan. Oleh karena itu, Lembaga Penyimpanan dan Penyelesaian, Perusahaan Efek, serta Bank Umum yang memenuhi persyaratan dan mendapat persetujuan Otoritas Jasa Keuangan dapat menyelenggarakan kegiatan usaha sebagai Kustodian.","
Yang dapat menyelenggarakan kegiatan usaha sebagai Kustodian adalah Lembaga Penyimpanan dan Penyelesaian, Perusahaan Efek, atau Bank Umum yang telah mendapat persetujuan Bapepam.",1
,,,36
